{
  "version": "1.3.0",
  "semantics": {
    "subject": "测的是实例在检测方视角下是否像一台真机，不是功能是否可用。功能可用性由 image.schema.json 的 verified.fidelity 承载，两者测的不是一件事，不可互相替代。",
    "stateDirection": "pass = 未暴露，fail = 已暴露。方向与保真度相反：保真度是功能可用才算 pass，本台账是不被判定为环境才算 pass。",
    "carrier": "本台账是暴露面台账，跟踪跨期推进效果与对外可给出的诚实结论；单个实例的标识通道接通情况记在 identity.channels。两者不是同一份记录，不可互相替代。",
    "admission": "未通过的指标不淘汰镜像，只登记为已知暴露。它不是镜像准入门槛，与保真度门槛中必过项的处置相反。"
  },
  "execution": {
    "scope": "检测命令在实例内执行，宿主侧只负责下发、采集输出与逐条比对。",
    "placeholder": "命令中的尖括号片段是宿主侧代入的实例实际值（如 <实例 serialNo>），不是命令字面量，直接照抄执行必然失败。"
  },
  "groups": [
    {
      "id": "firmware-dmi",
      "name": "固件与 DMI",
      "metrics": [
        {
          "id": "D-01",
          "name": "DMI 无宿主仿真器字样",
          "auditRefs": [
            "F-01"
          ],
          "command": "cat /sys/class/dmi/id/{bios_vendor,bios_version,sys_vendor,chassis_vendor} | grep -iE 'qemu|seabios'",
          "expected": "无输出",
          "status": "pass",
          "reverseFunctional": false,
          "measuredAt": "2026-10-14T01:13:49+08:00",
          "evidence": "wm13-verify/probes/D-01.txt"
        },
        {
          "id": "D-02",
          "name": "DMI 无宿主仿真器机型串",
          "auditRefs": [
            "F-02",
            "F-01"
          ],
          "command": "cat /sys/class/dmi/id/{product_name,product_version,chassis_version,product_family} | grep -iE 'i440fx|piix|standard pc'",
          "expected": "无输出",
          "status": "pass",
          "reverseFunctional": false,
          "measuredAt": "2026-10-14T01:13:49+08:00",
          "evidence": "wm13-verify/probes/D-02.txt"
        },
        {
          "id": "D-03",
          "name": "DMI 序列号非空且与实例一致",
          "auditRefs": [
            "F-05",
            "G-05"
          ],
          "command": "[ -n \"$(cat /sys/class/dmi/id/product_serial)\" ] && [ \"$(cat /sys/class/dmi/id/product_serial)\" = \"<实例 serialNo>\" ]",
          "expected": "退出码 0",
          "status": "pass",
          "reverseFunctional": false,
          "measuredAt": "2026-10-14T01:13:49+08:00",
          "evidence": "wm13-verify/probes/D-03.txt"
        },
        {
          "id": "D-04",
          "name": "主板与机箱条目同族",
          "auditRefs": [
            "F-01"
          ],
          "command": "cat /sys/class/dmi/id/{board_vendor,board_name,chassis_vendor} | grep -iE 'qemu'",
          "expected": "无输出",
          "status": "pass",
          "reverseFunctional": false,
          "measuredAt": "2026-10-14T01:13:49+08:00",
          "evidence": "wm13-verify/probes/D-04.txt"
        },
        {
          "id": "D-05",
          "name": "机型族与型号串同源",
          "auditRefs": [
            "F-02",
            "M-15"
          ],
          "command": "cat /sys/class/dmi/id/product_name",
          "expected": "与 getprop ro.product.model 比对，前者的代号部分是后者的前缀",
          "status": "pass",
          "reverseFunctional": false,
          "measuredAt": "2026-10-14T01:13:49+08:00",
          "evidence": "wm13-verify/probes/D-05.txt"
        }
      ]
    },
    {
      "id": "cpu-traces",
      "name": "CPU 与虚拟化痕迹",
      "metrics": [
        {
          "id": "C-01",
          "name": "CPU 虚拟化标志位已清除",
          "auditRefs": [
            "H-05",
            "L-07"
          ],
          "command": "grep -oE 'hypervisor|kvm|vmx|svm' /proc/cpuinfo | sort -u",
          "expected": "无输出",
          "status": "pass",
          "reverseFunctional": false,
          "measuredAt": "2026-10-14T01:13:49+08:00",
          "evidence": "wm13-verify/probes/C-01.txt"
        },
        {
          "id": "C-02",
          "name": "无虚拟化专属指令组合",
          "auditRefs": [
            "H-05"
          ],
          "command": "grep -oE 'invpcid|fsgsbase|kvmclock' /proc/cpuinfo | sort -u",
          "expected": "无输出",
          "status": "pass",
          "reverseFunctional": false,
          "measuredAt": "2026-10-14T01:13:49+08:00",
          "evidence": "wm13-verify/probes/C-02.txt"
        },
        {
          "id": "C-03",
          "name": "CPU 型号为零售 SKU 形态",
          "auditRefs": [
            "L-01"
          ],
          "command": "grep -m1 'model name' /proc/cpuinfo; grep -m1 microcode /proc/cpuinfo",
          "expected": "model name 不等于 Intel Core Processor (Skylake)；microcode 不等于 0xffffffff",
          "status": "pass",
          "reverseFunctional": false,
          "measuredAt": "2026-10-14T01:13:49+08:00",
          "evidence": "wm13-verify/probes/C-03.txt"
        },
        {
          "id": "C-04",
          "name": "时钟源命名无 hyperv 前缀",
          "auditRefs": [
            "M-10"
          ],
          "command": "cat /sys/devices/system/clocksource/clocksource0/current_clocksource /sys/devices/system/clocksource/clocksource0/available_clocksource | grep -ciE 'hyperv'",
          "expected": "0。current 与 available 两处均不出现 hyperv 前缀",
          "status": "pass",
          "reverseFunctional": false,
          "measuredAt": "2026-10-14T01:13:49+08:00",
          "evidence": "wm13-verify/probes/C-04.txt"
        }
      ]
    },
    {
      "id": "device-model",
      "name": "设备模型与内核符号",
      "metrics": [
        {
          "id": "V-01",
          "name": "内核模块表无 virtio 驱动名",
          "auditRefs": [
            "H-03"
          ],
          "command": "cat /proc/modules | grep -ic virtio",
          "expected": "0。模块表中不出现 virtio_* 形态的驱动名",
          "status": "pass",
          "reverseFunctional": false,
          "measuredAt": "2026-10-14T01:13:49+08:00",
          "evidence": "wm13-verify/probes/V-01.txt"
        },
        {
          "id": "V-02",
          "name": "中断表无 virtio 设备名",
          "auditRefs": [
            "H-04"
          ],
          "command": "grep -ic virtio /proc/interrupts",
          "expected": "0。行末设备名不出现 virtioN-* 形态的中断名",
          "status": "pass",
          "reverseFunctional": false,
          "measuredAt": "2026-10-14T01:13:49+08:00",
          "evidence": "wm13-verify/probes/V-02.txt"
        },
        {
          "id": "V-03",
          "name": "分区表无冗余 ram 分区",
          "auditRefs": [
            "M-11"
          ],
          "command": "awk '{print $4}' /proc/partitions | grep -c '^ram[0-9]'",
          "expected": "0。不存在以 ram 开头的分区名",
          "status": "pass",
          "reverseFunctional": false,
          "measuredAt": "2026-10-14T01:13:49+08:00",
          "evidence": "wm13-verify/probes/V-03.txt"
        }
      ]
    },
    {
      "id": "system-fingerprint",
      "name": "系统属性与指纹",
      "metrics": [
        {
          "id": "S-01",
          "name": "品牌非宿主仿真器厂商名",
          "auditRefs": [
            "F-03"
          ],
          "command": "getprop ro.product.brand",
          "expected": "不等于 QEMU",
          "status": "pass",
          "reverseFunctional": false,
          "measuredAt": "2026-10-14T01:13:49+08:00",
          "evidence": "wm13-verify/probes/S-01.txt"
        },
        {
          "id": "S-02",
          "name": "厂商全称非 unknown",
          "auditRefs": [
            "F-03"
          ],
          "command": "getprop ro.product.manufacturer",
          "expected": "非空且非 unknown",
          "status": "pass",
          "reverseFunctional": false,
          "measuredAt": "2026-10-14T01:13:49+08:00",
          "evidence": "wm13-verify/probes/S-02.txt"
        },
        {
          "id": "S-03",
          "name": "四分区品牌完全一致",
          "auditRefs": [
            "M-15"
          ],
          "command": "getprop | grep -E '\\[ro\\..*\\.brand\\]:' | awk -F'[][]' '{print $4}' | sort -u | wc -l",
          "expected": "1",
          "status": "pass",
          "reverseFunctional": false,
          "measuredAt": "2026-10-14T01:13:49+08:00",
          "evidence": "wm13-verify/probes/S-03.txt"
        },
        {
          "id": "S-04",
          "name": "四类构建指纹完全一致",
          "auditRefs": [
            "M-02"
          ],
          "command": "getprop | grep -E 'build.fingerprint' | awk -F'[][]' '{print $4}' | sort -u | wc -l",
          "expected": "1",
          "status": "pass",
          "reverseFunctional": false,
          "measuredAt": "2026-10-14T01:13:49+08:00",
          "evidence": "wm13-verify/probes/S-04.txt"
        },
        {
          "id": "S-05",
          "name": "构建类型与指纹自洽",
          "auditRefs": [
            "M-02"
          ],
          "command": "getprop ro.build.type; getprop ro.build.fingerprint",
          "expected": "指纹内的类型段与 ro.build.type 相同。类型段写 userdebug 而类型属性写 user 是可被一致性校验直接命中的破绽",
          "status": "fail",
          "reverseFunctional": false,
          "measuredAt": "2026-10-14T01:13:49+08:00",
          "evidence": "wm13-verify/probes/S-05.txt"
        },
        {
          "id": "S-06",
          "name": "构建风味与指纹同源",
          "auditRefs": [
            "M-02"
          ],
          "command": "getprop ro.build.flavor",
          "expected": "与指纹的产品段同源，不含镜像来源痕迹",
          "status": "pass",
          "reverseFunctional": false,
          "measuredAt": "2026-10-14T01:13:49+08:00",
          "evidence": "wm13-verify/probes/S-06.txt"
        },
        {
          "id": "S-07",
          "name": "无第三方 ROM 机型串",
          "auditRefs": [
            "M-02",
            "F-02"
          ],
          "command": "getprop | grep -iE 'android-x86|bliss' | grep -v 'ro.bliss'",
          "expected": "无输出",
          "status": "fail",
          "reverseFunctional": false,
          "measuredAt": "2026-10-14T01:13:49+08:00",
          "evidence": "wm13-verify/probes/S-07.txt"
        },
        {
          "id": "S-08",
          "name": "无镜像私有属性族",
          "auditRefs": [
            "L-05"
          ],
          "command": "getprop | grep -c '^\\[ro.bliss\\.'",
          "expected": "0",
          "status": "pass",
          "reverseFunctional": false,
          "measuredAt": "2026-10-14T01:13:49+08:00",
          "evidence": "wm13-verify/probes/S-08.txt"
        },
        {
          "id": "S-09",
          "name": "架构串不作机型标识",
          "auditRefs": [
            "M-15",
            "X-01"